{
    "$schema": "../../schemas/dev-center.schema.json",
    "subscriptionId": "00000000-0000-0000-0000-000000000000",
    "name": "contoso-dev-center",
    "resourceGroup": "rg-contoso-dev-center",
    "location": "UK South",
    "settings": {
        "enableCatalogsPerProject": true
    },
    "features": {
        "devBox": {
            "settings": {
                "allowMicrosoftHostedNetworkInProjects": true,
                "enableAzureMonitorAgentInstallation": false
            },
            "gallery": {
                "name": "contoso-dev-box-gallery"
            },
            "definitions": [
                {
                    "name": "VS2022EntBox",
                    "image": "microsoftvisualstudio_visualstudioplustools_vs-2022-ent-general-win11-m365-gen2",
                    "sku": "general_i_8c32gb1024ssd_v2",
                    "storage": "ssd_1024gb"
                },
                {
                    "name": "VS2022EntBoxAlt",
                    "image": "microsoftvisualstudio_visualstudioplustools_vs-2022-ent-general-win11-m365-gen2",
                    "sku": "general_i_8c32gb1024ssd_v2",
                    "storage": "ssd_1024gb"
                }
            ]
        }
    }
}